{
  "actionability_score": 9,
  "actionable_experiments": [
    {
      "effort": "high",
      "expected_effect": "Рост Sharpe за счёт адаптивного уменьшения экспозиции при ухудшении качества спреда и усилении риска.",
      "idea": "Заменить фиксированный hedge ratio/size в текущей парной стратегии на RL-агента, который выбирает leverage и долю позиции на каждом шаге.",
      "impact": "high",
      "wfa_checks": [
        "Определить reward с компонентами: PnL - λ1*DD - λ2*turnover - λ3*costs.",
        "Сделать train/validation/test разбиение по времени и сравнить baseline и RL-агента в 3 walk-forward окнах.",
        "Отслеживать стабильность performance при сдвиге regimes и просадки по кварталам."
      ],
      "why": "На волатильных крипто-рынках статические размеры позиции часто недооценивают смену риска и быстро накапливают DD."
    },
    {
      "effort": "medium",
      "expected_effect": "Снижение turnover и транзакционных потерь при схожем сигнальном качестве.",
      "idea": "Ввести в RL-политику штраф за торговую активность и проскальзывание, чтобы политика избегала мелких неэффективных сделок.",
      "impact": "medium",
      "wfa_checks": [
        "Сравнить policy с penalty=0 и penalty>0.",
        "Ограничить шаги торгов в fold для проверки устойчивости к разной частоте сделок.",
        "Оценить изменение maxDD и Sharpe после учёта costs."
      ],
      "why": "Даже хорошая предсказательная часть теряет эффект, если политика слишком агрессивна по rebalancing."
    }
  ],
  "key_findings": [
    "Предлагается заменить фиксированный масштаб позиционирования на управляемый политикой RL.",
    "Отдельные метаданные указывают присутствие leverage и stop-loss как управляемых блоков риска.",
    "Подход нацелен на повышение управляемости риска и потенциально на улучшение отношения доходность/просадка через адаптацию размера.",
    ""
  ],
  "method_family": [
    "reinforcement learning",
    "dynamic position sizing",
    "pair trading control policy"
  ],
  "paper_id": "1f91257d37bc",
  "pitfalls": [
    "В метаданных явно не отмечен out_of_sample, значит есть риск переобучения и завышенной оптимистической оценки.",
    "RL-цепочка обычно чувствительна к качеству reward; без явной формализации штрафов за DD и транзакции может ухудшаться практический Sharpe.",
    "Присутствуют риски интерпретации и воспроизводимости при смене рыночной микроструктуры."
  ],
  "schema_version": "card-v1.1.0",
  "summary": "Работа описывает RL-стратегию для pair trading с динамическим масштабированием позиции, где целевой эффект — адаптивное управление размером позиции под меняющиеся характеристики пары, включая leverage и механики ограничения убытков.",
  "text_sha256": "1f91257d37bcff4ea60d81f638306ac3ad01be937c82de297927eb37658a8cf7",
  "title": "Reinforcement Learning Pair Trading: A Dynamic Scaling Approach",
  "year": 2024
}