{
  "actionability_score": 7,
  "actionable_experiments": [
    {
      "effort": "medium",
      "expected_effect": "Снижение размерности входов и шумности сигналов, что обычно уменьшает волатильность доходности и просадку.",
      "idea": "Построить pair-spread модель на узком окне факторов, отобранных transfer entropy между leg-индикаторами и внешними криптофакторами.",
      "impact": "medium",
      "wfa_checks": [
        "Оценить A/B: full-факторный vs transfer-entropy набор на одинаковых walk-forward разбиениях.",
        "Считать Sharpe, maxDD и turnover на каждом окне, а также стабильность коэффициентов регрессии.",
        "Проверить, что улучшение сохраняется в out-of-sample сегментах."
      ],
      "why": "Статья прямо про выбор переменных в высокоразмерной задаче, а пары обычно страдают от многомерного шума."
    },
    {
      "effort": "low",
      "expected_effect": "Снижение торговли и комиссионного шума при сохранении качества сигнала, что улучшит net Sharpe.",
      "idea": "Заменить ежедневную перекалибровку факторов на редкую (например еженедельную) и сравнить с частой перестройкой.",
      "impact": "low",
      "wfa_checks": [
        "Зафиксировать 2–3 периода перекалибровки и сравнить maxDD/turnover.",
        "Проверить деградацию в период regime shifts и структурных разрывов.",
        "Сопоставить стоимость слеппиджа при разных частотах обновления."
      ],
      "why": "Для парной торговли в высокоразмерных системах частые пересчёты часто ухудшают DD через излишний turnover."
    }
  ],
  "evidence": [
    "Digest: «Transfer entropy», «random matrix test», «reduced rank regression», high-dimensional predictive model.",
    "keyword_hits: out_of_sample=true, robustness=true, transfer entropy implied by title, pca=true, clustering=false, copula=false."
  ],
  "key_findings": [
    "В описании явно заявлен метод отбора значимых факторов для high-dimensional крипто-модели.",
    "Используется transfer entropy как инструмент переменной, что полезно для причинно-ориентированного отбора признаков.",
    "Random matrix test и RRR применяются для структурирования модели, а out_of_sample/robustness отмечены как флаги методической проверки."
  ],
  "method_family": [
    "transfer entropy feature selection",
    "random matrix test",
    "high-dimensional predictive modeling",
    "reduced-rank regression"
  ],
  "paper_id": "0d4abd4c1ce7",
  "pitfalls": [
    "Метод не дает готового торгового сигнала для пар и не описывает механизм формирования hedge-спреда в переданном фрагменте.",
    "Не приведены explicit Sharpe/DD и торговые метрики, поэтому эффект для pair trading нужно валидировать заново.",
    "Не раскрыты параметры стоимости исполнения (slippage/fees, leverage), что критично для DD контроля."
  ],
  "schema_version": "card-v1.1.0",
  "summary": "Работа формулирует задачу выбора информативных переменных для высокоразмерной криптовалютной прогнозной модели через transfer entropy и random matrix test; для pair trading ценна для построения компактного набора факторов и снижения переобучения в volatile regime.",
  "text_sha256": "0d4abd4c1ce7cf2912d70e5aa9f32b71b05f1ff4f203367f8a4a1fbc1827b2e0",
  "title": "Transfer entropy as a variable selection methodology of cryptocurrencies in the framework of a high dimensional predictive model",
  "year": null
}