{
  "actionability_score": 9,
  "actionable_experiments": [
    {
      "effort": "high",
      "expected_effect": "Улучшение среднего Sharpe за счёт удержания только статистически связанных и устойчивых в текущем режиме пар с более мягкой просадкой.",
      "idea": "Собрать пул пар по cointegration и затем переключаться между ними через copula-ориентированный регимный скор в каждом окне волатильности.",
      "impact": "high",
      "wfa_checks": [
        "WFA по 5 шагов: train 4 нед, test 1 нед или train 6 мес, test 1 мес; max_steps<=5.",
        "Метрики: annualized Sharpe, maxDD, average turnover, число убыточных окон.",
        "Сравнить с фиксированным пулом top-N pairs при идентичных транзакционных издержках."
      ],
      "why": "Самой близко к статье методологически: адаптивная ротация + cointegration + copula дают готовый каркас для регимного отбора пары."
    },
    {
      "effort": "medium",
      "expected_effect": "Снижение частоты убыточных микропереходов и более стабильная просадочная кривая в период рыночного шума.",
      "idea": "Добавить hard-constraint на минимальный net-edge после комиссий (аппроксимация по spread-slippage), чтобы входы проходили только при ожидаемом маржеже после fee.",
      "impact": "medium",
      "wfa_checks": [
        "Для каждого окна теста считать net-alpha = gross - commissions и фильтровать сигналы ниже порога.",
        "Сравнить с baseline без комиссии-порогов по maxDD и Calmar ratio.",
        "Проверить устойчивость порога на 2–3 уровнях fee/slippage scenarios."
      ],
      "why": "В материале явно показано влияние комиссий; этот контроль прямо конвертируется в DD management для pair trading."
    }
  ],
  "evidence": [
    "Excerpt содержит численные значения: 100000→110166.66 до комиссий и 110056.49 после.",
    "keyword_hits: cointegration=true, copula=true, drawdown=true, pair-trading relevance, slippage=true, transaction_costs=true, rl=true."
  ],
  "key_findings": [
    "Текст явно утверждает адаптивную ротацию пар в волатильных условиях.",
    "В фрагменте результатов указано, что портфель вырос с 100000 до 110166.66 до комиссий и до 110056.49 после комиссий.",
    "Отмечена минимальная разница между брутто и нетто доходностью, что косвенно указывает на управляемый транзакционный след.",
    "Дается сравнение с базовыми моделями по кумулятивным monthly returns с преимуществом предлагаемого подхода."
  ],
  "method_family": [
    "cointegration-based pair selection",
    "copula dependency modeling",
    "adaptive pair rotation"
  ],
  "paper_id": "29b3d7801fd5",
  "pitfalls": [
    "Из переданного фрагмента не извлечена детализация критериев риска (Sharpe/DD расчеты, частота ребалансов, ограничения leverage).",
    "Не указаны параметры регенерации очереди/валидации по walk-forward, поэтому устойчивость вне выборки не подтверждена.",
    "Нужна отдельная оценка влияния смены regime и просадок при экстремальных сжатиях ликвидности."
  ],
  "schema_version": "card-v1.1.0",
  "summary": "Работа прямо про улучшение pairs trading через Adaptive Pair Rotation в волатильных рынках с использованием cointegration и copula, демонстрирует тестовый прирост капитала и устойчивость к комиссиям; это наиболее прямой источник для немедленного WFA-применения в задаче Sharpe↑ и DD↓.",
  "text_sha256": "29b3d7801fd5e0c77f8b1f7468bf160d9cf73240037af43d902a87640f22e23e",
  "title": "Enhancing Pairs Trading with Adaptive Pair Rotation Strategies in Volatile Markets",
  "year": 2025
}