{
  "actionability_score": 6,
  "actionable_experiments": [
    {
      "effort": "medium",
      "expected_effect": "Ожидается меньше ложных входов на неликвидных участках, более ровный поток сделок и снижение просадок через избегание плохого исполнения.",
      "idea": "Добавить VVR и VWAP как обязательные признаки в модель прогноза спреда между парой и запускать вход только при достаточной ликвидности спреда.",
      "impact": "high",
      "wfa_checks": [
        "Сравнить baseline без VVR/VWAP и версию с ними на одинаковом OOS-разбиении.",
        "Считать Sharpe и максимальный DD по одинаковому окну трансакций.",
        "Включить транзакционные издержки и slippage в backtest-метрику для каждой конфигурации."
      ],
      "why": "Статья подтверждает, что ликвидность повышает предсказуемость, а pair trading особенно чувствителен к проскальзыванию и нестабильному исполнению."
    },
    {
      "effort": "medium",
      "expected_effect": "Снизится риск переобучения и выбросы доходности за счёт выбора устойчивой модели под реальные рыночные режимы.",
      "idea": "Запустить турнир из четырёх моделей из статьи (LR, RF, XGBoost, LSTM) как генераторов сигналов для одного pair-trading алгоритма и выбрать лучшую по OOS Sharpe.",
      "impact": "medium",
      "wfa_checks": [
        "Единый набор признаков и транзакционной модели для всех 4 алгоритмов.",
        "Проводить walk-forward OOS или скользящее окно с обновлением параметров.",
        "Сравнить не только доходность, но и частоту убыточных серий и DD.",
        "",
        "wfa_checks"
      ],
      "why": "Работа уже предоставляет готовый набор сравниваемых алгоритмов и базу для контролируемого отбора без добавления новой модельной архитектуры."
    },
    {
      "effort": "low",
      "expected_effect": "Ожидается более стабильный профиль доходности и снижение потенциальной просадки за счёт адаптивного ограничения риска в уязвимых участках.",
      "idea": "Использовать VVR для динамического позиционного скалирования: снижать лот в периодах пониженной ликвидности и возвращать его при нормализации.",
      "impact": "medium",
      "wfa_checks": [
        "Разделить историю на квантили VVR и задать детерминированные коэффициенты шкалы позиции.",
        "Оценить влияние на DD и Hit ratio в каждом квантили-слое.",
        "Сравнить с фиксированным размером позиции на тех же торговых правилах."
      ],
      "why": "Даже без полного описания position sizing в статье, связка ликвидность-предсказуемость даёт явный сигнал для риска-адаптации в парной логике."
    }
  ],
  "key_findings": [
    "Авторы вводят прокси ликвидности VVR и VWAP как дополнение к ценовым/объёмным данным для прогноза.",
    "Показаны четыре базовых подхода к прогнозированию: Linear Regression, Random Forest, XGBoost и LSTM.",
    "В качестве основного тезиса статьи выступает, что учёт ликвидности лучше отражает рыночную устойчивость и может улучшать сигнализацию для торговли."
  ],
  "method_family": [
    "machine_learning",
    "time_series_forecasting",
    "liquidity_features"
  ],
  "paper_id": "5a6f4e60d49e",
  "pitfalls": [
    "В текущем фрагменте отсутствуют численные результаты и метрики эффективности по каждому алгоритму.",
    "Работа фокусируется на одной паре (XRP/USDT), без явной валидации переносимости на другие пары и спреды.",
    "Не раскрыт полный торговый флоу (как сигналы переводятся в вход/выход, риск-менеджмент и правила ребалансировки).",
    "Нет прямых упоминаний о механике контроля комиссий, лимитах и фактическом влиянии на Sharpe/Drawdown."
  ],
  "schema_version": "card-v1.1.0",
  "summary": "Исследование для пары XRP/USDT рассматривает прогноз закрытия с помощью машинного обучения с дополнительными метриками ликвидности VVR и VWAP, чтобы повысить информативность прогнозов. Применены Linear Regression, Random Forest, XGBoost и LSTM на базе криптовалютных данных, что делает работу прикладным источником для построения торговых признаков под pair trading.",
  "text_sha256": "5a6f4e60d49e3bf2677cc4ad25244ae7b8007f536f3bd9a05f77bad45c43b3cb",
  "title": "International Journal of Accounting and Economics Studies, 12 (3) (2025) 255-268",
  "year": 2025
}