{
  "actionability_score": 7,
  "actionable_experiments": [
    {
      "effort": "medium",
      "expected_effect": "Получить метод с лучшим net Sharpe и меньшим drawdown при сопоставимой turnover.",
      "idea": "Запустить локальный benchmark-ранжир между несколькими методами (коинтеграционный спред, Kalman filter, OU-based) на одном пуле пар и одинаковых расходных параметрах.",
      "impact": "high",
      "wfa_checks": [
        "Фиксировать одинаковый набор пар и сроки in-sample/out-of-sample.",
        "Считать CAGR, Sharpe, maxDD, turnover и влияние fee/slippage.",
        "Собрать минимум 3 walk-forward folds и сравнить стабильность ранжирования методов."
      ],
      "why": "Сравнение на единых затратах и фильтрах уменьшает риск выбора только теоретически красивого, но практикой неприменимого метода."
    },
    {
      "effort": "low",
      "expected_effect": "Снижение просадок без полного отказа от алмазов доходности на лучших спредах.",
      "idea": "Добавить обязательный stop-loss и leverage caps внутри выбранного метода, оптимизируя параметры на цель Sharpe и ограничение DD.",
      "impact": "medium",
      "wfa_checks": [
        "Параметризовать stop-loss на нескольких уровнях, зафиксировать распределение maxDD.",
        "Проверить стабильность через перекрёстное тестирование режимов и комиссионное проскальзывание.",
        "Оценить изменение числа убыточных кластеров подряд."
      ],
      "why": "Даже лучший метод может резко ухудшаться без риск-ограничения на отдельных хвостовых срабатываниях."
    }
  ],
  "key_findings": [
    "Рассматривается несколько статистических подходов для отбора/трейдинга пар в крипте с акцентом на эффективность и устойчивость.",
    "Подтверждается значимость остановки через stop-loss и учёта leverage/transaction costs при практической реализации.",
    "Сигнализация связана с OU-динамикой и высокими рыночными рисками, что делает задачу управления DD центральной для оценки."
  ],
  "method_family": [
    "comparative backtesting",
    "cointegration methods",
    "Kalman filter",
    "Ornstein-Uhlenbeck modeling",
    "risk controls"
  ],
  "paper_id": "fd3ff852e63a",
  "pitfalls": [
    "Выводы вероятно завязаны на конкретном наборе параметров и рынке, а переносимость на текущие пары/временной ряд не гарантирована.",
    "Нет явных указаний на walk-forward как обязательный протокол в представленном фрагменте; возможен эффект look-ahead.",
    "Не указаны подробности исполнения на конкретном venue, а это критично для комиссии и slippage в live."
  ],
  "schema_version": "card-v1.1.0",
  "summary": "Исследование проводит сравнительный анализ статистических методов для парного трейдинга в крипторынке и позиционирует задачу как выбор надёжного и эффективного подхода в условиях высокой волатильности.",
  "text_sha256": "fd3ff852e63a935a8c3cd2b2e0ba7f4f8c1765e017d927aa115aab12ea5212cc",
  "title": "Pairs trading in cryptocurrency markets: A comparative study of statistical methods",
  "year": 2022
}