{
  "actionability_score": 7,
  "actionable_experiments": [
    {
      "effort": "medium",
      "expected_effect": "Снижение числа сделок и шума должно повысить Sharpe и сократить DD за счёт снижения выбросных убытков.",
      "idea": "Превратить технические сигналы из роли генератора самостийных входов в роль фильтра для отклонений спреда и входить только при подтверждении mean-reversion в паре.",
      "impact": "high",
      "wfa_checks": [
        "OOS-валидация на нескольких cutoff и rolling окнах",
        "Сравнить базовый pair-trading и фильтрованную версию по Sharpe и max drawdown",
        "Включить комиссию и slippage в PnL с фиксированным плечом"
      ],
      "why": "Исходная работа показывает слабую standalone прибыльность техсигналов, поэтому их лучше использовать как условный фильтр, а не как основной alpha-источник."
    },
    {
      "effort": "low",
      "expected_effect": "Ожидается снижение просадки при сохранении части доходимости сделок и более сглаженный equity curve.",
      "idea": "Добавить строгие лимиты размера позиции и ежедневный маржинальный риск-кап, затем пересчитать performance с учётом leverage/position sizing.",
      "impact": "medium",
      "wfa_checks": [
        "Таблица чувствительности по размерам позиции и leverage",
        "Тестирование контроля DD на стресс-сценариях",
        "Оценка транзакционных расходов на уровень turnover"
      ],
      "why": "Метаданными заданы темы leverage и position sizing; контроль этих параметров напрямую адресует DD и делает выводы более эксплуатационными."
    }
  ],
  "evidence": [
    "\"We provide ... investigation into the profitability of technical trading methods... BTC/USDT and ETH/USDT\"",
    "\"establish statistically significant conclusions regarding the lack of profitability\"",
    "keyword_hits: out_of_sample, drawdown, leverage, position_sizing, slippage, transaction_costs"
  ],
  "key_findings": [
    "Технич. стратегии в изученном контуре BTC/USDT и ETH/USDT не показали устойчивой прибыльности по главным метрикам.",
    "Ввод отсечки (cutoff date) и альтернативные OOS-разбиения не меняют вывод о слабой значимости alpha.",
    "Отмечена важность транзакционных издержек, слippage и выбора плеча/размера позиции для фактического профиля риска."
  ],
  "method_family": [
    "technical strategy evaluation",
    "data-snooping control",
    "out_of_sample testing",
    "position sizing stress",
    "transaction-cost and slippage-aware assessment",
    "robustness checks"
  ],
  "paper_id": "169fe985ca18",
  "pitfalls": [
    "Результат относится к двум парам и относительно короткому периоду, что снижает прямую переносимость на большие наборы активов.",
    "Фокус на технических индикаторах сам по себе не гарантирует применимости в рыночно-нейтральной среде.",
    "Без дополнительного regime-фильтра есть риск переизбытка сделок и ухудшения DD из-за шума на входах."
  ],
  "schema_version": "card-v1.1.0",
  "summary": "Работа на BTC/USDT и ETH/USDT тестирует четыре технические стратегии на данных 2022–2023 с акцентом на data-snooping защиту и несколько разрезов in-sample/out-of-sample; итоговая находка в переданном контексте — устойчивого профита по этим методам не подтверждено.",
  "text_sha256": "169fe985ca182e8dd00199e98082e132de9e44b3a3f6eb8142a6955d881de26c",
  "title": "Wei Li Shanghai Louis Investment Management",
  "year": 2023
}