{
  "actionability_score": 7,
  "actionable_experiments": [
    {
      "effort": "medium",
      "expected_effect": "Ожидается рост устойчивости доходности и контроль просадки за счёт отбора только статистически подтверждённых и быстрее-реигрирующих спредов.",
      "idea": "Построить ранжирование пар по коинтеграционному статусу (BTC, ETH, LTC, XRP или расширенный список) и выбрать только сигналы с допустимым half-life в каждом regime.",
      "impact": "medium",
      "wfa_checks": [
        "Реализовать out-of-sample split по историческим подокнам с разными фазами рынка.",
        "Сравнить Sharpe, maxDD и hit-rate для статического и regime-aware отбора.",
        "Ввести сценарии комиссий и slippage, затем пересчитать эффективность по net returns."
      ],
      "why": "Короткий half-life обычно соответствует более управляемому риску позиции и меньшей длительной фиксации капитала под просадку."
    },
    {
      "effort": "high",
      "expected_effect": "Повышение среднего Sharpe через уменьшение потерь на стрессовых участках и более раннее ограничение DD.",
      "idea": "Сочетать кластеризацию рыночных режимов с градацией размера позиции: в «тихих» режимах повышать экспозицию, в «турбулентных» — снижать.",
      "impact": "high",
      "wfa_checks": [
        "Задать хотя бы 2 regime (низкая/высокая волатильность) и сравнить распределение DD.",
        "Оценить turnover и PnL contribution на каждом regime-слое.",
        "Проверить, что улучшение устойчиво в трёх и более roll-forward окнах."
      ],
      "why": "Регимная неоднородность крипторынка обычно меняет характер расхождения спредов и устойчивость сигналов."
    }
  ],
  "key_findings": [
    "Анализ строится на неминимально-стационарных криптоактивах и применении методов коинтеграции для построения арбитражных связей.",
    "Контекст включает разделение на режимы и оценку half-life, что близко к идее адаптивного горизонта удержания позиции.",
    "В цепочке параметров есть акценты на транзакционных издержках, slippage, turnover и защите просадки (stop-loss), что важно для практической применимости к Sharpe/DD."
  ],
  "method_family": [
    "cointegration analysis",
    "pair selection",
    "regime-aware modeling",
    "position sizing",
    "stop-loss-aware execution"
  ],
  "paper_id": "de03aa93a208",
  "pitfalls": [
    "Данные только дневные; без явной детализации высокочастотной реализации качество сигнала может не переноситься в live.",
    "Есть риск режима/структурного сдвига вне окна 2022–2024 и некалиброванных предположений по комиссиям.",
    "Входная информация не раскрывает формулу построения стратегического кэпитала и точный механизм валидации по кросс-средам."
  ],
  "schema_version": "card-v1.1.0",
  "summary": "Исследование на BTC, ETH, LTC и XRP (январь 2022–октябрь 2024) применяет статистический арбитраж на основе коинтеграции с строгими эконометрическими процедурами и отмечает режимно-зависимые аспекты, half-life и управление позициями.",
  "text_sha256": "de03aa93a2086b7c5296ddf57fdc92a9e337156cc340bfa8afd198151248e0e8",
  "title": "Statistical Arbitrage Strategies Using Cointegration Analysis in Cryptocurrency Markets",
  "year": 2026
}