{
  "actionability_score": 6,
  "actionable_experiments": [
    {
      "effort": "medium",
      "expected_effect": "Sharpe↑ за счёт избегания высокорисковых режимов; DD↓ через снижение экспозиции в стресс-режимах.",
      "idea": "Добавить HMM-режимы как risk-фильтр для входов/плеча в pair trading.",
      "impact": "high",
      "wfa_checks": [
        "Walk-forward: обучение HMM только на IS, применение режимов строго OOS.",
        "Сравнить Sharpe/MaxDD/Calmar с и без режимного фильтра на одинаковых сделках/порогах.",
        "Чувствительность к числу режимов и частоте переобучения (еженедельно/ежемесячно).",
        "Проверка деградации на смене структурного режима (до/после крупных рыночных шоков) и на разных парах."
      ],
      "why": "Абстракт прямо мотивирует режимность крипто-волатильности; HMM можно использовать для переключения risk-бюджета стратегии."
    },
    {
      "effort": "medium",
      "expected_effect": "DD↓ и более стабильная доходность за счёт контроля хвостовых потерь и экспозиции.",
      "idea": "Ввести лимиты по ES/VaR для спред-портфеля и динамически резать позиции при росте хвостового риска.",
      "impact": "high",
      "wfa_checks": [
        "Walk-forward: калибровать модель риска на IS, пороги ES/VaR фиксировать и валидировать OOS.",
        "Сравнить распределение дневных PnL и tail-loss (например, 1% худших дней) до/после.",
        "Проверить, что улучшение не достигается за счёт резкого падения trade count/времени в рынке.",
        "Проверить робастность к окнам оценки (короткие/длинные) и к стресс-периодам."
      ],
      "why": "Статья целится в VaR/ES для крипто; эти метрики естественно превратить в риск-ограничения (kill-switch/position scaling) для пары/корзины пар."
    },
    {
      "effort": "high",
      "expected_effect": "Sharpe↑ через снижение рыночной компоненты шума; DD↓ через уменьшение общей факторной экспозиции.",
      "idea": "Построить факторную (гетероскедастическую) модель крипто-универсума и нейтрализовать общий фактор в парных позициях.",
      "impact": "medium",
      "wfa_checks": [
        "Walk-forward: оценка факторов на IS, применение фактор-нейтрализации весов OOS.",
        "Проверить снижение корреляции PnL с прокси-«рынком» (например, равновзвешенный индекс) без потери ожидаемой доходности.",
        "Сравнить MaxDD и длительность просадок для фактор-нейтральных vs обычных весов.",
        "Проверить устойчивость на разных наборах активов и при смене волатильностного режима (по HMM)."
      ],
      "why": "Абстракт описывает факторную структуру и динамическую взаимосвязь активов; для pair trading это можно использовать как улучшенную хедж-настройку весов/нейтрализацию факторов."
    }
  ],
  "evidence": [
    "В абстракте заявлена цель: оценка VaR и ES в крипто-контексте.",
    "Указаны ключевые элементы метода: режимность волатильности (HMM), факторная структура (heteroskedastic factor analysis), Monte Carlo и вариационный EM.",
    "Мотивация: режимные переключения и динамические связи между крипто-активами, которые нужно учитывать в оценке риска."
  ],
  "key_findings": [
    "Фокус на оценке VaR и ES в контексте крипто-рынка.",
    "Подход явно учитывает режимность (regime switching) крипто-волатильности через HMM.",
    "Динамическая взаимосвязь активов моделируется через факторную структуру (гетероскедастическая factor analysis) и используется Monte Carlo для оценки риска."
  ],
  "method_family": [
    "Hidden Markov Model (regime switching)",
    "Heteroskedastic factor analysis",
    "Monte Carlo simulation",
    "(Structured) variational EM"
  ],
  "paper_id": "243c9ce7f858",
  "pitfalls": [
    "В предоставленном фрагменте нет деталей про качество/точность оценок VaR/ES и сравнение с базовыми методами.",
    "Фрагмент не содержит параметризации HMM (например, число режимов) и практических настроек, что усложняет прямое внедрение.",
    "Метод ориентирован на риск-метрики портфеля (VaR/ES), а не на построение сигналов/спредов для pair trading.",
    "Учет транзакционных издержек заявлен в ключевых словах, но в доступном тексте нет конкретики, как они встроены в оценку риска."
  ],
  "schema_version": "card-v1.1.0",
  "summary": "Статья про оценку риска в крипто-портфелях через Value-at-Risk (VaR) и Expected Shortfall (ES) с учётом переключения режимов волатильности и динамической взаимосвязи активов. Предлагается композитный подход на базе Monte Carlo, гетероскедастической факторной модели и Hidden Markov Model (HMM), обучаемых вариационным EM. Для pair trading это полезно как слой risk/regime-фильтрации и ограничений по хвостовому риску для повышения Sharpe и снижения просадок.",
  "text_sha256": "243c9ce7f858871f9f4fc94b006411249e58e44bbfeaeff1caf373cd6937acb2",
  "title": "(15) Stat., Optim. Inf. Comput. Vol. 12, March 2024",
  "year": 2024
}