{
  "actionability_score": 8,
  "actionable_experiments": [
    {
      "effort": "high",
      "expected_effect": "Увеличение Net Sharpe и снижение turnover за счёт отказа от микродвижений, которые не покрываются комиссионно.",
      "idea": "Ввести в scoring пары штрафы за стоимость ребалансировок, основанные на maker/taker и модели slippage, и оптимизировать выбор входа в позицию с учётом этих затрат.",
      "impact": "high",
      "wfa_checks": [
        "Сравнить baseline spread-стратегию и вариант с cost-penalty на одинаковых парах и окнах.",
        "Провести чувствительность к bps издержек и модели slippage, проверить деградацию Sharpe и maxDD.",
        "Валидировать через walk-forward с max_steps<=5 и зафиксированным max positions per fold."
      ],
      "why": "В pair trading часто много коротких входов/выходов; без затратного штрафа стратегия может выглядеть прибыльной в backtest и проседать после вычета расходов."
    },
    {
      "effort": "medium",
      "expected_effect": "Снижение ненужной торговой активности и транзакционных потерь, более ровный кумулятивный PnL.",
      "idea": "Добавить минимальный интервал (cooldown) между ребалансировками при небольших отклонениях spread, чтобы уменьшить шумовые открытия и закрытия.",
      "impact": "medium",
      "wfa_checks": [
        "Прогнать варианты cooldown (например 1, 3, 5 свечей), сравнив число сделок и maxDD.",
        "Оценить impact на turnover и просадку отдельно на train/validation/test подрядами по времени.",
        "Зафиксировать ухудшение/улучшение turnover-adjusted Sharpe."
      ],
      "why": "Даже при хорошем сигнальном edge излишние микрореалокации ухудшают DD в период боковика и сужают запас риска."
    }
  ],
  "key_findings": [
    "Транзакционные издержки рассматриваются как ключевой фактор, существенно влияющий на итоговую доходность и качество управления рисками.",
    "В классическом варианте портфельной оптимизации акцентируется риск/доходность без прямого учёта издержек поддержания портфеля.",
    "Связь с turnover и slippage прямо указывает на потенциал для снижения DD и повышения стабильности при вводе штрафов на частые ребалансировки."
  ],
  "method_family": [
    "risk parity",
    "minimum-variance optimization",
    "transaction cost-aware allocation",
    "turnover control"
  ],
  "paper_id": "6cd91b80cca3",
  "pitfalls": [
    "Материал про общий портфельный allocation, а не про конкретную логику спредовых пар и спредовые сигналы.",
    "Непонятно, есть ли walk-forward/разделение на устойчивые out-of-sample окна в используемой схеме экспериментов.",
    "Не раскрыта детальная калибровка параметров комиссий и порядка заявок для конкретной биржи, а это влияет на эффект в live."
  ],
  "schema_version": "card-v1.1.0",
  "summary": "Статья показывает, что в задаче минимального риска для портфеля игнорирование транзакционных издержек делает оценку эффективности некорректной: ребалансировки портфеля снижают фактический Sharpe и могут усиливать просадки, особенно при частой смене весов.",
  "text_sha256": "6cd91b80cca37a111c29977af0a9d928354149e12934ab5cecd109e9c2f16858",
  "title": "On transaction costs in minimum-risk portfolios: insights into risk parity and asset allocation",
  "year": null
}