{
  "actionability_score": 7,
  "actionable_experiments": [
    {
      "effort": "medium",
      "expected_effect": "Sharpe↑ и DD↓ за счёт удаления общих трендов и диверсификации long-short по нескольким инструментам.",
      "idea": "Построить 2-факторную модель и торговать факторно-нейтральные остатки на корзине (BTC/ETH/LTC/XMR).",
      "impact": "high",
      "wfa_checks": [
        "Rolling-оценка факторов и тесты стационарности остатков по окнам (train/OOS)",
        "Сегментация результатов по режимам: до/после конца августа 2019",
        "Комиссии/издержки: прогон по сетке fee и поиск break-even",
        "Контроль turnover и вклад издержек в PnL/Sharpe",
        "Ограничения риска: max DD по окнам и худшее окно (worst-window)"
      ],
      "why": "Аннотация прямо указывает на достаточность двух динамических факторов и на торговую long-short конструкцию поверх факторной структуры."
    },
    {
      "effort": "low",
      "expected_effect": "DD↓ за счёт избегания неблагоприятных режимов; Sharpe↑ за счёт меньших провальных периодов.",
      "idea": "Добавить режимный фильтр: де-рисковать/отключать входы, когда модель выявляет отсутствие стационарного фактора.",
      "impact": "high",
      "wfa_checks": [
        "Правило режима на основе rolling тестов unit-root для факторов",
        "Сравнение PnL/Sharpe/DD с фильтром и без него на одинаковых издержках",
        "Проверка частоты переключений режима и влияния на turnover",
        "Стабильность порогов фильтра в walk-forward (не переоптимизировать)",
        "Worst-window DD: убедиться, что фильтр уменьшает хвостовой риск"
      ],
      "why": "В аннотации описана смена режима (стационарный фактор исчезает после конца августа 2019), что естественно использовать как фильтр риска."
    },
    {
      "effort": "high",
      "expected_effect": "Sharpe↑ и DD↓ через более стабильные оценки факторов и меньше ложных сигналов при смене режима.",
      "idea": "Сравнить оценивание факторов/нагрузок: PCA-бейзлайн vs state-space/Kalman-подход (если применимо к реализации).",
      "impact": "medium",
      "wfa_checks": [
        "Фиксировать торговую логику, менять только оцениватель факторов",
        "Сравнить стабильность факторов/нагрузок и распределение ошибок по режимам",
        "Turnover + издержки: одинаковая модель комиссий для честного сравнения",
        "Robustness по длине окон обучения и частоте переоценки",
        "Отдельная проверка поведения в период смены режима (конец августа 2019)"
      ],
      "why": "Контекст указывает на динамические факторы и наличие ключевых тем Kalman/PCA; сравнение оценивателей может улучшить устойчивость сигналов."
    }
  ],
  "evidence": [
    "digest/excerpt: «apply dynamic factor analysis» для BTC/ETH/LTC/XMR; «model with two dynamic factors».",
    "digest: «one integrated and one stationary factor until the end of August 2019 and two integrated factors afterwards».",
    "digest: «define a multiple long-short trading strategy which proves profitable…» (фрагмент обрывается).",
    "keyword_hits: cointegration=true, copula=true, crypto=true, funding=true, kalman=true, pca=true, regime=true, structural_break=true, transaction_costs=true."
  ],
  "key_findings": [
    "Для корзины BTC/ETH/LTC/XMR эмпирически достаточно модели с двумя динамическими факторами (по аннотации).",
    "До конца августа 2019 наблюдается один интегрированный и один стационарный фактор; после — два интегрированных (смена режима/структурный сдвиг).",
    "На основе выявленной факторной структуры определяется множественная long-short стратегия; в аннотации заявлена прибыльность, но условия/метрики в предоставленном фрагменте не раскрыты."
  ],
  "method_family": [
    "динамический факторный анализ (dynamic factor model)",
    "факторно-нейтральный long-short statistical arbitrage",
    "регимы/структурные сдвиги (structural break)",
    "интеграция/стационарность факторов (unit-root/cointegration-тематика)"
  ],
  "paper_id": "072130146eb9",
  "pitfalls": [
    "Смена режима (конец августа 2019) означает риск внезапной потери стационарности «краевых» спредов и роста DD при фиксированной модели/порогах.",
    "Если оба фактора интегрированные, mean-reversion может ослабнуть; без контроля стационарности сигналов Sharpe может резко просесть.",
    "Транзакционные издержки и (для деривативов) funding способны съесть edge; без явного стресс-теста по costs Sharpe может быть завышен.",
    "В предоставленном контексте не видно явного OOS/WFA-процесса; без walk-forward есть риск переобучения на одном режиме."
  ],
  "schema_version": "card-v1.1.0",
  "summary": "В предоставленной аннотации статья моделирует совместную динамику BTC/ETH/LTC/XMR через динамический факторный анализ и показывает, что для описания корзины достаточно двух динамических факторов. Также фиксируется смена режима: до конца августа 2019 один фактор интегрированный, второй стационарный; после — оба фактора интегрированные. На этой базе авторы формулируют множественную long-short стратегию статистического арбитража (в фрагменте заявлена прибыльность, но детали в предоставленном тексте обрываются).",
  "text_sha256": "072130146eb9643f4c8c4eb804d0ce992781b3f488dacfb556755b5535f89aad",
  "title": "Common dynamic factors for cryptocurrencies and multiple pair-trading statistical arbitrages",
  "year": 2021
}